username,author id,created,text,retwc,hashtag,followers,friends,polarity,subjectivity
SPECIALK 🗯,18892596,2017-05-23 23:27:58,Lmao my mom stressed me tf out during finals https://t.co/KvO8DK7LM1,3306,None,309021,9717,0.6,1.0
Rick Wilson,19084896,2017-05-23 01:58:06,"The Trump trolls are out in force tonight. Either that Bitcoin payment went through, or they're feeling stressed.",651,None,166749,3268,0.0,0.0
Nooruddean,176754253,2017-05-24 14:40:59,"This can't be stressed enough. It's not just his father dying, it's watching his health deteriorate over time. That... https://t.co/srO6l9kZDq",154,None,80002,1669,0.0,0.5
Shannon Coulter,7019512,2017-05-23 21:54:02,"You sound stressed, Sean. You stressed? https://t.co/OjVZecegVm",178,None,58391,19908,0.4,0.4
King Wolfie,136651187,2017-05-24 00:05:21,sorry about the vlogs being posted late lately  been a little stressed lately,344,None,570103,2236,-0.3175,0.66
Cleveland Clinic,24236494,2017-05-23 16:20:01,"Breathe deep. A full, deep breath makes your lungs &amp; chest send signals to your brain and you feel calmer.... https://t.co/eOANxDh6x8",83,None,982066,994,0.11666666666666665,0.45
CM of Karnataka,2713703797,2017-05-23 10:16:27,Fortunate to have spent time with HH the Dalai Lama today. He stressed the importance of Karuna in our daily life. https://t.co/jt6pFiCSLi,72,None,117584,537,0.10000000000000002,0.26666666666666666
James Charles,1117786405,2017-05-23 02:37:44,i don't have an outfit for tomorrow yet and i'm stressed,110,None,204962,854,0.0,0.0
Cleveland Clinic,24236494,2017-05-23 16:00:02,"Acupressure is a complementary treatment to acupuncture without needles.
Try this if you're stressed:... https://t.co/4l7nfrIdbz",21,None,982066,994,0.0,0.0
Lindsay MacDonald,2805954792,2017-05-24 17:58:23,"I don't think I've ever been more stressed out than when watching tonight's #The100. This finale is everything, guys.",40,The100,1866,615,0.5,0.5
د.رياض حجاب,4196168301,2017-05-23 11:14:22,Process of political transition must be made in accordance with UN mediation in Geneva - I stressed in meeting with... https://t.co/Akldh13Vyx,17,None,69280,16,0.0,0.1
InStyle,14934818,2017-05-24 05:32:54,5 physical signs you're way too stressed and need to take a breather https://t.co/D9yVxdufcL,22,None,4542732,2759,0.0,0.14285714285714285
Mac,23065354,2017-05-19 22:36:37,I just passed my drivers test. Feeling very 16. Stressed out about the SATs.,10499,None,6475337,1215,0.2,0.3
Entrepreneur,19407053,2017-05-24 19:45:07,#TipoftheDay: Feeling stressed out and overwhelmed? @letgotogrow has a suggestion that can move you forward. https://t.co/OkJpHh2VDV,34,TipoftheDay,3044061,1442,0.0,0.0
UN News Centre,104277809,2017-05-24 17:52:22,.@WHO Director-General-elect Mr. Tedros stressed the need to provide health care for all and to implement internati... https://t.co/lrtzG6NLIB,22,None,268636,688,0.0,0.0
Laurence Tribe,4091551984,2017-05-16 02:26:19,".@RepAlGreen rightly stressed on @allinwithchris that impeachment is like indictment, not conviction, which demands... https://t.co/Am2T7P1yk7",276,None,132751,1085,0.2857142857142857,0.5357142857142857
The Notebook,233430873,2017-05-19 03:17:01,"Care less, and you won't be so stressed.",625,None,5767369,176,-0.16666666666666666,0.06666666666666667
Monica Alba,71584155,2017-05-18 11:44:39,"White House officials stressed yesterday that the president had a ""measured"" response to Mueller news. 12 hours lat... https://t.co/TvUVPhNLBy",373,None,22921,2110,0.0,0.0
Aseefa B Zardari,130159846,2017-05-18 08:42:26,CM #Sindh has personally been monitoring #polio situation and stressed the importance of reaching &amp; vaccinating every child to protect them,360,Sindh,1201979,718,0.0,0.3
AcneSkinSite,143014330,2017-05-17 01:45:07,"Pamper yourself. If you're feeling stressed, your skin is going to show it. Treat yourself and your skin to a home made spa day.",495,None,835627,6,0.0,0.0
Rachel Ballinger,468957900,2017-05-18 21:13:20,"Feeling stressed? SQUISH IT OUT! Watch my DIY stress ball video... Guys, they were awesome to make https://t.co/OpYmqa1Ka9",121,None,424648,4802,1.0,1.0
Mark Medina,19319374,2017-05-17 01:10:05,"On using No. 2 pick to draft player or trading it, Magic Johnson and Rob Pelinka stressed importance of keeping long term future in mind",94,None,42286,1425,0.15,0.5083333333333333
KOENA MITRA,154916905,2017-05-19 15:08:09,"#AmiKkr 
Ami confused.
Ami Stressed. 
Ami Speechless. 
Ami worried. 
Do something #Kkr 
@iamsrk Tomar luck Ektu diye Dao Kkr ke",129,AmiKkr,547749,9,-0.4,0.7
Funny Or Die,15693493,2017-05-16 22:00:36,"Stressed out trying to keep up with Trump, Comey, Russia leaks, etc? Try this new meditation on for size. https://t.co/WPisvtclM7",141,None,14203725,5683,0.13636363636363635,0.45454545454545453
Mikki Kendall,100136358,2017-05-18 11:31:17,I was getting stressed out by the order of succession then names of people implicated started to leak &amp; well...will there be a GOP left?,67,None,74624,1033,-0.2,0.25
BRANDON WARDELL,58323389,2017-05-18 21:20:31,"r u guys going 2 that dorm party later? dam. my social studies class has me stressed out, brother. i cant wait 2 underage drink tonight hehe",137,None,169766,1040,0.016666666666666666,0.03333333333333333
Becca Tilley,31047270,2017-05-18 04:15:23,I am NERVOUS for the Grey's finale tomorrow!Just watched last weeks episode &amp; feeling STRESSED. What would I tweet about without this show?,118,None,221363,282,-0.025,0.08333333333333334
Sopan Deb,48120914,2017-05-16 02:02:50,I could be in a hostage situation and I wouldn't be more stressed than I am right now.,76,None,166149,4649,0.39285714285714285,0.5178571428571428
Brad Williams,18723984,2017-05-19 03:40:18,News got you stressed out? Here's a dwarf jumping into a ball pit https://t.co/3B1JxFXdbz,107,None,65608,284,0.0,0.0
Tay Jardine,17693277,2017-05-19 13:54:44,Why is it that seeing all these anti stress fidget toys make me stressed out?????,111,None,164637,332,0.0,0.0
